{
  "receiptId": "rcpt_a1b2c3d4e5f6a7b8c9d0e1f2a3b4c5d6",
  "intentId": "int_a1b2c3d4e5f6a7b8c9d0e1f2a3b4c5d6",
  "executionId": "exec_a1b2c3d4e5f6a7b8c9d0e1f2a3b4c5d6",
  "status": "confirmed",
  "steps": [
    {
      "stepId": "step_a1b2c3d4e5f6a7b8c9d0e1f2a3b4c5d6",
      "chainId": 1,
      "type": "transaction",
      "order": 0,
      "status": "confirmed",
      "transactionHash": "0xa1b2c3d4e5f6a7b8c9d0e1f2a3b4c5d6e7f8a9b0c1d2e3f4a5b6c7d8e9f0a1b2",
      "target": "0x742d35cc6634c0532925a3b844bc9e7595f2bd3e",
      "value": "1000000000000000000",
      "gasUsed": "21000",
      "feePaid": "21000000000000",
      "startedAt": "2026-01-15T10:30:01Z",
      "completedAt": "2026-01-15T10:30:15Z"
    }
  ],
  "totalFeePaid": "21000000000000",
  "totalGasUsed": "21000",
  "createdAt": "2026-01-15T10:30:01Z",
  "confirmedAt": "2026-01-15T10:30:15Z"
}
